CardID	Name	Description	Gen	Rarity	Elements	BaseAttack	BaseHealth	CardValueMulti	UseBigImage	TexturePath	TexturePath2	TexturePath3	TexturePath4	TexturePath5	TexturePath6	RegistryName	Raw
7318	Tuanlumon	Carrying a huge ball of hair on his back, he is good at sewing wool into various things using superb textile skills.	6	2	2	152	138	1.7999999523163	false							Tuanlumon	FCardDataAll: 000002133244BBE0
7319	Zandalar Dragon	The god worshiped in the annual Zandalari festival is said to be able to protect the health of animals and children.	6	2	9	166	125	1.9500000476837	false							Zandalar Dragon	FCardDataAll: 00000212F257CBA0
7401	Bubble Fin Beast	The Bubblefin is a soft-bodied, jellyfish-like, slippery creature with a purple-blue body, a peculiar snail-shaped "horn" and an exaggerated single-eyed expression. Despite its funny appearance, Bubblefin is actually very intelligent and full of emotions, often using exaggerated movements to attract the attention of its companions.	6	3	11	50	420	1.1000000238419	false							Bubble Fin Beast	FCardDataAll: 000002133244E7A0
7402	Runbo Whale	It looks like a combination of a whale and a seal, and often carries a green little friend in its belly. They live in warm shallow waters or coastal areas and feed on aquatic plants and plankton.	6	3	1	87	266	1.1000000238419	false							Runbo Whale	FCardDataAll: 000002133244E960
7403	Genmiaoling	It likes to hide in the shadows of woods, using its curly roots to imitate other plants for camouflage. When frightened, it will jump up suddenly and use its roots to jump short distances.	6	3	2	35	650	1.4500000476837	false							Genmiaoling	FCardDataAll: 000002133244C9E0
7404	Star Attack Beast	The meteor demon spirit among the celestial bodies, its tail drags a stream of stardust. The silence that can tear the night sky apart is the shadow that night watchers fear most.	6	3	10	25	910	1.3500000238419	false							Star Attack Beast	FCardDataAll: 000002132DEE2720
7405	Flame Shadow Demon	The flame ghost wrapped in red and blue flames has a strange figurine and has extremely strong defense-breaking and suppression capabilities.	6	3	0	105	210	1.25	false							Flame Shadow Demon	FCardDataAll: 000002132DEE28E0
7406	Illusory Law Divine Envoy·Zhimiao	A musician in the ice and snow, his singing can control the movement of snowflakes.	6	3	12	150	150	1.25	false							Illusory Law Divine Envoy·Zhimiao	FCardDataAll: 000002132DEE2AA0
7407	Hot-Blooded Style·Fire Sun	The immovable pillar of the student union, the fist represents justice	6	3	0	214	102	1.3099999427795	false							Hot-Blooded Style·Fire Sun	FCardDataAll: 000002132DEE2C60
7408	Azlon	Two fists can defeat hundreds of hands	6	3	5	220	105	1.5	false							Azlon	FCardDataAll: 000002132DEE2E20
7409	Mommy Taming	A mysterious character who uses bandages to wrap around enemies	6	3	11	135	210	1.3600000143051	false							Mommy Taming	FCardDataAll: 000002132DEE2FE0
7410	Blade Scale Shark	Dragons with excellent physical fitness and super adaptability	6	3	9	158	148	1.460000038147	false							Blade Scale Shark	FCardDataAll: 00000212F257A360
7411	Dead Fin Whale	Its heavy body and thick skin make it the most solid creature in the ocean.	6	3	1	50	500	1.4299999475479	false							Dead Fin Whale	FCardDataAll: 00000212F257A1A0
7412	Pointed Crest Worm	Wherever a hole can be dug, the terrain will be used to launch unexpected attacks.	6	3	4	110	200	1.2799999713898	false							Pointed Crest Worm	FCardDataAll: 00000212F2579FE0
7413	Shimmering Lion	A super creature that can control gravity and use gravity and repulsion to attack	6	3	10	214	102	1.5	false							Shimmering Lion	FCardDataAll: 00000212F2579E20
7414	Yunmengyao	A light goblin, it is said that it is difficult to hit it through physical attacks, because the air fluctuations caused by physical attacks will cause it to naturally dodge and avoid attacks.	6	3	10	202	116	1.4199999570847	false							Yunmengyao	FCardDataAll: 00000212F2579C60
7415	Millions of cats	A cat that attracts treasure, especially gold.	6	3	7	133	185	1.8799999952316	false							Millions of cats	FCardDataAll: 00000212F2579AA0
9001	Ah Yinzi		9	3	0	50	100	1.0	false							Ah Yinzi	FCardDataAll: 00000212F25798E0
9002	Eric		9	3	11	50	100	1.0	false							Eric	FCardDataAll: 00000212F2579720
9003	Lingxue		9	3	12	50	100	1.0	false							Lingxue	FCardDataAll: 00000212F2579560
9004	KF		9	3	3	50	100	1.0	false							KF	FCardDataAll: 00000212F25793A0
9005	wawa	Hyperactive challenger that likes to welcome a challenge	9	3	0	55	105	1.0	false							wawa	FCardDataAll: 00000212F25791E0
9006	Tobe	Cool, collected, and 10 steps ahead	9	3	5	55	105	1.0	false							Tobe	FCardDataAll: 00000212F2579020
9007	EXIA	the unknown traveler that will uncover secrets of the world	9	3	10	55	105	1.0	false							EXIA	FCardDataAll: 00000212F2578E60
9008	YIMING	HaHAHa	9	3	10	299	1	1.0	false							YIMING	FCardDataAll: 000002132AECEEA0
9060	Killa	A partner from Russia.	9	3	5	30	150	1.0	false							Killa	FCardDataAll: 000002133244EB20
9061	An Jiang	A sweet-looking girl.	9	3	11	30	200	1.0	false							An Jiang	FCardDataAll: 000002133244E7A0
9062	Snow Maid	This maid is very cold.	9	3	12	22	150	1.0	false							Snow Maid	FCardDataAll: 00000212F257CBA0
9063	Bunny girl	A pair of bunny ears is very sexy.	9	3	1	25	190	1.0	false							Bunny girl	FCardDataAll: 000002133244BBE0
9064	Alice	She is a European and American girl who loves adventure.	9	3	8	20	190	1.0	false							Alice	FCardDataAll: 000002133244A1A0
9065	ANO	A sunny and handsome boy	9	3	11	10	300	1.0	false							ANO	FCardDataAll: 000002133244A360
9066	Longqi Princess	The girl was born from the dragon's nest and accompanied the golden dragon in the deep forest. From the little black box user——kkzzzz_	9	3	9	60	150	1.0	false							Longqi Princess	FCardDataAll: 000002132AEC9AA0
9067	Fool	An immature kitten, its body is bright white, with gorgeous golden lines on its body, and its eyes are like a touch of gold smeared in the ink. From the little black box——TIMI1502	9	3	10	60	150	1.0	false							Fool	FCardDataAll: 0000021332446EE0
9068	ANT	ANT is ANO’s cousin and he looks very handsome.	9	3	10	200	80	1.0	false							ANT	FCardDataAll: 000002132AEC0260
9069	Sakura Girl	A beautiful JK girl from Japan with pink hair and a light fragrance.	9	3	11	15	300	1.0	false							Sakura Girl	FCardDataAll: 000002132AEC0420
9071	Kaikai is here	Station B UP master-KF Kaifeng	9	3	11	50	200	6.5	false							Kaikai is here	FCardDataAll: 000002132AEC05E0
9072	Stewed goose in iron pot	B station UP master-Lingxue stays at home	9	3	11	50	200	6.5	false							Stewed goose in iron pot	FCardDataAll: 000002132AEC07A0
9073	Sakacaicai	Station B UP master-Saka Caicai	9	3	11	50	200	6.5	false							Sakacaicai	FCardDataAll: 000002132AEC0960
9074	Junior Leng Yang	Station B UP master - Junior Leng Yang	9	3	11	50	200	6.5	false							Junior Leng Yang	FCardDataAll: 000002132AEC0B20
100001	Rain God·Yi Lianjiaji		0	4	1	150	500	10.0	false							Rain God·Yi Lianjiaji	FCardDataAll: 000002132AEC0CE0
100002	Luna Aragos		0	4	11	150	500	10.0	false							Luna Aragos	FCardDataAll: 000002132AEC0EA0
100003	Fire God Lieluohuangne		0	4	0	150	500	10.0	false							Fire God Lieluohuangne	FCardDataAll: 000002132AEC1060
100004	Grass God·Made Flower Reiki		0	4	2	150	500	10.0	false							Grass God·Made Flower Reiki	FCardDataAll: 000002132AEC1220